title+selftext,label,chatgpt-label_2,chatgpt-label_1,new_label,chatgpt-label_3
"I am so sorry. Firstly I will admit I don’t have much advice but I want you to know you’re not alone. 
 
 I’m in a very similar situation myself. I’m 21, jobless, highly anxious, and my mum has cancer in her liver which has spread to her surrounding organs. She has ascites also, and a tumour is obstructing her bowels meaning she’s unable to keep any food or drink down. A meeting with the palliative care team yesterday revealed she’s only got a few weeks left. She was moved to a palliative care facility today. 
 
 I think your mum is probably aware she doesn’t have a whole lot of time left. I think she might be putting on a brave face to try and keep strong for you. Whether you’d like to tell her the news yourself or not is totally up to you, don’t feel like you’re obligated to do anything you’re not comfortable with. 
 
 As for you, this is the most important time you need to be taking care of yourself. Losing your father and mother is definitely not an easy thing. I would encourage you to turn to your good friends and your brother for support, and maybe even speak with a counsellor. It is incredibly hard to deal with all this on your own. Also make sure you’re focusing on your health, eat 3 times a day and stay hydrated. Your physical health has a massive effect on your mental health. 
 
 Keep your head up and make the most of the time you have left with your mum. Talk about anything you need to say, maybe write a letter if it’s easier. Try to forgive her for what she’s done for your own sake rather than hers. Holding onto that anger will only hurt you in the long run. Be kind to yourself &lt;3",neutral,positive,positive,neutral,support
WOW how does an ONCOLOGIST not know how to hook a patient up with a social worker to get help with this? Hospice.. palliative care... she needs a social worker to help her find the resources to pull this together.,neutral,positive,positive,neutral,neutral
"Can she not stand/lie straight due to bone or back pain or some form of loss of motor function in her legs? That would be suggestive of bone mets as well.
 
 As for time left - the doctor is best placed to answer that though with untreated cancer in soft tissue I cant imagine it would be more than a year tops. However, ongoing plural draining will be a real drag on any quality of life she has left, even if she doesn't want any form of conventional cancer treatments. Is she adverse to trying the targeted pill therapies available now for Stage IV? Assuming she is hormone positive, two pills once a day could clear up the lungs and give her more time with the family, in a comfortable manner. 
 
 There are other scans than a PET especially if its something this obvious - a CT would allow them to get a look at whats going on in there and she won't be in a tube, but will have to lie down. The doctors need to know what they are dealing with in order to at least provide palliative care and management of her symptoms.",positive,neutral,neutral,support,neutral
"Are you asking about palliative care - which is treating symptoms and making life more comfortable at any phase of treatment - or about hospice, which is end-of-life care?",positive,neutral,neutral,support,support
"Hi there. I also have incurable bone cancer (Ewing’s sarcoma). Bone pain is so fucking rough man. And I have neuropathy too. I’m gonna tell you my pain meds that I take every day. 
 
 Gabapentin (nerve pain)
 Amitriptyline (nerve pain)
 Hydromorphone (opioid for overall body/bone pain)
 Celebrex (aleve works too) (NSAID drug which helps my bone pain)
 
 I’m telling you those so that when you talk to a palliative/pain doctor, you can advocate for him and ask questions about more specific drugs if you need to. But you absolutely, 100% need to get in contact with a palliative pain doctor (as some other commenters have said already). As soon as I was diagnosed as terminal, they hooked me up with one. She does house calls so I don’t need to go to the hospital as much, and she hooked me up with a extramural program (EMP) which helps me with other things. Those are the people who know what to do for him and know how to do it well. That is what you need. 
 
 I am wishing the very best for you and your family. This fucking sucks and I’m sorry it’s happening to you guys. I wish I could help more with the insurance and money stuff, but I’m 19 and live in Canada lol.",positive,positive,positive,support,neutral
"Initially diagnosed oct 2017 with invasive ductal carcinoma stage 2B intermediate grade. Her2+, ER/PR-. I was 36 yrs old. 
 
 Nov 2017- March 2018Did 3 cycles of FEC. 3 cycles of Docetaxol. Had a complete pathological response to chemo.
 
 April 2018 Unilateral left side modified radical mastectomy 
 
 Opted not to have radiation. 
 
 Feb 2018 Bone mets found on CT scan after I complained of a sore back and neck and had a sudden increase in blood calcium. Mets were located on vertebrae T2, T6, T11. Chemo caused these mets to calcify. 
 
 Started Herceptin and Zometa Feb 2018 and have been on them for the past 4 yrs.
 
 Generally I am doing well and have had zero progression in 4 yrs. I do have joint and muscle pain through out my body. We assume it is from the chemo and targeted treatments. I deal with a ton of brain fog to the point I quit driving (backing into my MIL's brand new car one evening solidified that for me). I am tired a lot and extremely unreliable due to fatigue and the general feeling of being unwell and so I no longer work, which for some may sound great but it is really isolating. It seems the only time I leave my house is for medical appointments. But I get to be with my kids and raise them with their dad, my husband. I am grateful to have no progression and to be able to mostly care for myself. I have a great support system especially with my husband. 
 
 I was never given a timeline on life expectancy. In fact my original oncologist just out right refused to talk about it and would repeat ""Mindy you are fine and healthy. You will be here many years."" I fired him last year because I felt he wasn't listening to my concerns and was being extremely dismissive. If I got upset about anything at all he would state that I need therapy and then compare me to his other patients. I used to get printed copies of everything in my health records and in one of his consults to my family doctor he advised her that my estimated lifespan would be 5-7 yrs. I have now used up 4 of those years. Others in my situation consider this a chronic condition. I however can not see it like that, it is ultimately a terminal illness and unless something else kills me first cancer is my death sentence. I am ok with this, I made peace with this very quickly. There is power in acceptance. I say this because initially I was extremely emotional, fearful and angry. I wasted so much of my precious time crying and staying in bed feeling sorry for myself that I knew it wasn't sustainable and nor was it fair to myself or my family. It took months of hard work and self reflection and what I finally found helped me was to sit down and write out my advanced medical directives and make a plan for end of life care. I live in Canada and so we have access to medical assistance in dying and so I met with them and had all my questions answered. I also met with palliative care who really helped me feel at ease with my situation. They answered the questions my oncologist refused to answer and they reassured me that their role was quality of life vs my oncologist's stance of quantity of life. I feel that because I was able to let go of the anger and fear and make peace with my fate that I have been a happier more present mom and wife. Now that's not to say I don't have bad days. I do, frequently but I am much more capable of recognizing those days, giving the fear, anger and sadness the space it needs and then I get on with it. 
 
 I have a lot in my life to be grateful for. If I get to see my children off into adulthood I will be able to die knowing that I served my purpose and that they will all be fine.",positive,positive,positive,support,support
You can talk to a pain management doc or palliative/supportive care,positive,neutral,neutral,support,support
"Does your treatment center offer a support team? Where I work I usually involve them to help these conversations. We have social workers and a nurse practitioner to help these conversations. We also have an in-house palliative care team that is wonderful at having these conversations with people's family. 
 
 I'm sorry you are going through this on top of everything.",positive,positive,positive,support,support
"if you ever end up feeling too sick to function mentally in daily life I'd suggest asking your doctor for some pain medicine like dilaudid or fentanyl because those are excellent anti-depressants (there's a reason why opiate addicts are able to live in the gutter perfectly happy while high on their drugs). nderf.org.
 
 There's no point to living in pain if you don't want to because palliative care means you get access to all the most life-altering happy drugs where you could take them and have a great day every day. Just ask for them. They make you feel so much better, which is why they're so controlled, people get stuck on them specifically because they make you feel much better, but they aren't that mind-altering in the sense that say getting drunk or high on weed is.",positive,positive,positive,support,neutral
Is your father stage 4? It really depends on how aggressive the type of cancer he has is. Folfox is usually palliative so people stay on it until it stops working or into their body cannot tolerate it anymore. Breaks are often okay before surgery and after and also if your bloodwork isn’t great. Doctors will give a week or two break to allow your white blood cell counts etc to come back up naturally. It isn’t always a bad thing but delaying treatment in advanced disease is also not the best. Your doctors know best 80% of the time.,not relevant,neutral,neutral,unrelated,neutral
"What does your oncologist say. That is the person to talk to. They will be able to answer all of your questions and determine whether or not you should delay treatment. And as a cancer patient you should call the hospital and speak to a palliative care nurse who can give you information about your type of cancer and what it means related to pain and death.
 
 Also you say that you have cancer on your face and that you are worried about chemo. I don’t understand the kind of cancer and why chemo and not radiation or surgery or immunotherapy. If you’ve been diagnosed with cancer they have given you a specific diagnosis. If it is on your face is it skin cancer?",positive,neutral,neutral,support,neutral
"No please don’t ever apologize. It’s just surreal .The prognosis is grim, it’s terminal, radiation will be palliative in nature. I finally found one doctor on his team that didn’t sugar coat and tell me about the power of prayer. We are lucky for 6 months and that’s with radiation ( full head). My husband doesn’t know , he’s thinking with treatment he has 5 years, it’s obvious different doctors on his team are looking to milk the insurance company for as much as they can and therefore putting my husband through unnecessary pain. There are masses on the lungs with the largest being wrapped around vital organs including the aorta. There are several brain tumors scattered around the cerebellum, the brain stem , the cerebrum and the largest on frontal lobe. Getting the biopsy was difficult reason being the first attempt failed because the masses necrotized. ( that if I’m using the correct terminology, but its dead calls ) whatever that means but I’d imagine not good.",neutral,negative,positive,neutral,neutral
"Is she having any form of care at the moment? Palliative/pain etc? It would be worthwhile asking if you could go along to some medical appointments with her and also to find out what help and supports are out there. As well as medical supports there are charities and other organisations out there you can look for help and information from depending on where you are. 
 
 She may be very overwhelmed and struggling or may be feeling like she knows what’s right for her but letting her know you want to help and will be there for her would be great (I’m sure you’ve already done this). She may be trying to protect you too. 
 
 Just continue to be a good support to her and help as much as she will allow. Thinking of you both.",neutral,positive,positive,neutral,support
"See if there is palliative care in your area. Here, you can get it in home. Maybe you have that? Palliative is different from hospice in that they aren’t focused on end of life, but symptom and disease management. They have a bad connotation but they are extremely extremely helpful with stuff around ADLs and pain. I highly recommend this. 
 
 Also, caregiver support for you. You can’t take care of her if you’re not taking care of yourself. Hugs! 
 
 I’m a chronic disease RN with a ton of experience if you have any questions.",positive,positive,positive,support,support
"My mother was diagnosed with stage four pancreatic about a year and a half ago. It too had spread to her liver. They told her she had a year with chemo, maybe six months without.
 
 So she started the palliative chemo and is doing remarkably well. She's already outlived the initial ""expiration date"" (her words, not mine) and feels ok between chemo sessions. 
 
 I know this is borrowed time. I'm not getting my hopes up that she can beat this; I don't think anyone can. I don't know how many xmases she has left, but I can probably count them on one hand.
 
 I wish I could comfort you, tell you it's all gonna be ok, but you and I both know that's bullshit. The entire situation sucks. I'm almost 40, but I'm not ready for a world without my mom in it.
 
 Fuck cancer.",positive,positive,positive,support,support
"My husband and I self-referred to palliative care, because if we’d waited for his oncologist to suggest it, we could‘ve been waiting a long time. We both knew where we were/are heading, and our experience has been positive so far. My husband is continuing palliative chemotherapy for the time being, which they have been fine with, and their occupational therapist has been fantastic sourcing equipment to keep him comfortable and at home for as long as possible.",positive,positive,positive,support,support