title+selftext,label,chatgpt-label_2,chatgpt-label_1,new_label,chatgpt-label_3
"Psilocybin Therapy for End-of-Life Distress/Palliative Care Patients - First Legal Treatment in Canada - Webinar VideoThomas Hartle was diagnosed with terminal Cancer and has been struggling with end of life distress and extreme anxiety.
 
 On August 4th Thomas Hartle was one of four Canadians experiencing end-of-life distress, due to life-threatening cancer, that received an exemption to possess and use psilocybin for medical purposes. 
 
 Yesterday he shared his experience as the first Canadian to legally undergo Psilocybin Therapy.
 
 [Watch the First Legal Psilocybin Therapy Treatment in Canada - Webinar](https://youtu.be/1CGcrSzLWPY)",neutral,neutral,positive,neutral,neutral
Any staff here that work in palliative care?Have some questions about palliative care if there's anyone here that knows anything,neutral,neutral,neutral,neutral,neutral
Palliative Procedures for Lung Carcinoid Tumor Symptoms - Lung Cancer Blog,cannot tell,cannot tell,cannot tell,unrelated,unrelated
"What do you wish your family knew before starting hospice and palliative care?My dad is nearing the end of his struggle with Myxoid Liposarcoma, he’s been Stage 4 for almost two and a half years now and likely won’t make it till next summer. My mother and I are trying to set up palliative care and/or hospice care for him, so I figured I’d ask what people wished they’d known before starting the process to try to save my mother any unnecessary stress by anticipating any issues that could come up. Due to the pandemic we’re trying to keep him comfortable at home as long as possible to reduce the risk of him being exposed to infections, so if anyone has suggestions I’m all ears.",neutral,positive,positive,neutral,support
"FREE online psychotherapy for anxiety and depression in oncology and palliative care patients (ONTARIO)If you are struggling with anxiety and or/depression and you are an oncology patient, at any stage of illness, you may benefit from our program.
 
 Queens University Online Psychotherapy Lab (QueensOPL) is recruiting participants. Through our program, we offer weekly sessions of online psychotherapy and you will receive personalized feedback from a trained therapist. We will be offering 8 weekly sessions of e-CBT.
 
 If you are interested, please contact wither of the following:
 
 Email: [opt4.ecbt@queensu.ca](mailto:opt4.ecbt@queensu.ca) 
 Website: [https://www.queensopl.ca/self-referral-page](https://www.queensopl.ca/self-referral-page)
 
 https://preview.redd.it/jmll4ya729491.jpg?width=2550&amp;format=pjpg&amp;auto=webp&amp;s=d2986e373cbd8b376e6acf72772968bb092cdda6",neutral,positive,positive,neutral,support
"Step dad doesn't have much time left. Stage 4 lung cancer (pancoast tumor) now in cervical veterbrae, but not brain. Palliative never checked this out, and I'm curious if it's associated with cancer",neutral,neutral,neutral,neutral,support
"Needing support/advice. Dad has stage 4 lung cancer and is in a lot of pain. Palliative care is full and I can't stand to see him suffer.Like the title says, my dad has non small cell lung cancer and is metastatic in bones and liver. We found out mid Jane, and they said he had 6 mos to live. He's a 100% disabled vet, and all his care for last 25 years has been with the VA. I have mixed feelings about them over all, but the people in critical care have been very supportive. Things have escalated very quickly. Before his first chemo treatment they said he was too weak for it. He's now on high flow oxygen and we found out last week he won't be coming home. He's been confused, but has been able to talk and hold a conversation up until Saturday night. He is in a tremendous amount of pain, can't talk, and pain medication they have him on doesn't seem to be enough. Palliative care is double booked and they're trying to get him into there or hospice, but they're waiting for him to be in less pain because he won't have a sitter in hospice. That doesn't exactly make sense to me, because they said he'll be in less pain in palliative care! Just don't know what to believe or think. Meanwhile he is suffering, and it's so hard to sit back and feel like you can't do anything. This sucks. I wouldn't wish this on my worse enemy. If you read this, thanks for listening. Just needed to get this out.",positive,negative,positive,support,support
"Cancer Management, Symptom Control and Palliative Care",cannot tell,neutral,neutral,unrelated,neutral
"My dad was just placed on palliative care. Such a selfless man his whole life, we just convinced him to install a fish tank which he's always wanted but could never condone. I love this man.",neutral,positive,positive,neutral,neutral
"Medicare coverage (Medicare A and B) for palliative care while still undergoing treatment?Hi all, my mom is ill with Glioblastoma; it would be an understatement to say it's a horrific disease. She's unmarried and I'm an only child and I'm having trouble caring for her. It's hard to enjoy the moment because you're just waiting for the rug to be pulled out from beneath you (again).
 
 Does anyone know if Medicare Parts A and B cover outpatient palliative care while the patient is still undergoing treatment? My mom just finished her first round of chemotherapy and radiation and is so sick, exhausted, and dejected; it is so hard to see her like this and we need help. We have very little money and are in the process of applying for help from our county's social services department, but it's an extremely difficult, slow, and bureaucratic process.
 
 I'll post responses to the r/glioblastoma and r/braincancer subs, but we're very small communities, so it's harder to find responses. 
 
 Thank you so much. Sending love and support.",neutral,positive,positive,neutral,support
"Optimistic but the worst is yet to come? Mom with palliative Multiple MyelomaHi all! 
 
 My mom has MM and has been battling for about 5 years. She’s 86 years old. Recently the doctors found that medication and chemo was no longer beneficial - so they stopped all treatment and referred us to palliative care. It’s been a few weeks, and honestly it’s like having my mom back without all the side effects of the chemo. 
 
 That being said - I know what’s coming around the corner. Oncologist gave me a very vague timeline, which I totally respect, but does anyone have experience with this? I’m really trying to enjoy this time we have now, but I know it can change on a dime. Having the whole family in for Christmas and hoping my mom can still be with us for one more year.",positive,positive,positive,support,support
"Palliative careMy dad called. His long term partner was taken to hospital and is in palliative care with stage 4 Neuroendocrine cancer. I know no one can say how long she has but is this the end?
 
 I’m half the world away and disabled so I can’t rush there. Dad was obviously to upset to ask.",neutral,neutral,neutral,neutral,neutral
"Palliative radiotherapy.I posted about my grandmother a couple of weeks ago. 
 We've received the results of the CT scan and it's revealed that the cancer is all around the throat and neck, she can have radiotherapy which would extend her life to 5 months. Without radiotherapy it'll be 2 weeks to 2 months, not sure how to cope with this, the woman who brought me up and taught me so much is going to pass away and I am so helpless.. only me and my mum know how long, my nan didn't want to know. 
 I'm being strong for her because what she is going through is 100x worse than how I feel but fuck, I feel so numb and angry at the world.
 Fuck cancer",neutral,negative,neutral,neutral,neutral
"UPDATE: What is palliative care [hospice] at home like?My dad was home for 3 weeks, then passed away peacefully with my siblings, mom and I by his side. The medical team visited us nearly every weekday and we had numbers to contact if we needed additional help outside their visits (we only used that one time and a team was sent immediately to administer pain medication). We felt pretty well supported by the medical staff which was all thankfully covered by the national health care system.
 
 It was really hard some of the time, dealing with constant diaper changes, vomiting blood, delirium, and a ton of medications to keep track of. But it was also what my dad wanted and I think we fulfilled that pretty well. There were a few good times with conversations and watching bits and pieces of a movie together, and getting to pet his beloved cats.
 
 If anyone else is caring for dying relatives at home I'd be happy to chat about it over PM if there is any way I can help.",positive,positive,positive,support,support
"Palliative Care - When to StartHi all, when in your experience is the best time to begin a relationship with a palliative care doctor? 
 
 I was chatting with my wife’s coordinator at UCSF and she mentioned it may be beneficial. My wife was diagnosed 6 months ago, GBM, clear scans since resection, on her 4th? cycle of temodar, using Optune with 90% usage. Should we wait till reoccurrence or do it now while she’s still in good shape (all things considered). Any regrets not starting it earlier?
 
 Thanks for your support and all the great info here.",positive,neutral,neutral,support,neutral
"Weed and Palliative PatientMy Mom was diagnosed with pancreatic cancer in late July, which has spread to her liver and several other organs. She's palliative and has opted out of chemo. Less than 3 months she was given.
 
 She is managing her pain with 6mg Dilaudid every 12 hrs but her appetite is starting to seriously wane.
 
 I am trying to encourage her to try a bit of weed. Smoke a tiny bowl.
 
 She's a conservative Christian woman (with a liberal heart) and for that reason resistant to the idea, though it's almost legal here in Canada. I am not a regular weed smoker myself, but am panicking a bit as I know this might help her. Also, she smokes cigarettes so smoke is not an issue.
 
 Has anyone been through this type of situation?
 EDIT: No Oncologist. No chemo or radiation. Just her GP and MAiD papers for when she gets to a certain point.",neutral,positive,neutral,neutral,support
Reflections on palliative care in India: a long goodbye,neutral,neutral,cannot tell,neutral,unrelated
People who are suffering from cancer. We are doing research on how to improve the mental heath of patients on palliative care. We are seeking people to interview so that we can tailor this intervention. Would it be possible for you to comment on this post or PM me? I would appreciate your help!,positive,positive,positive,support,support
Immunotherapy didn’t work. Palliative radiation and a chemotherapy are our next steps. Looking for advice as the son of the ill parent,neutral,neutral,neutral,neutral,neutral
"My Dad was diagnosed with Stage 4 Pancreatic Cancer in December. Dad has always been the hard-charging bread winner in the house. He has had to quit working and is currently in Palliative Care in the hospital. Any contribution to assist with the ongoing medical expenses is very much appreciated,",neutral,cannot tell,neutral,neutral,support
"I can answer one of those questions: you can use either VA OR private insurance/medicare. The VA will only pay for care received at a VA facility unless you have prior approval, which is not easy to get unless you live far away from a VA hospital. 
 
 Personally, I have had some very bad experiences with the VA, so if you have any alternative, I would suggest going with that.
 
 Private insurance will almost always be your primary payer of his treatment, so you should get a list of hospice programs that are in his network. Those programs will determine what care he will get. Perhaps you can start there. If he's been to an oncologist, they will have palliative care specialists that can help you choose and answer a lot of your other questions. 
 
 Sending you my thoughts ❤️
 
 Edit: by primary payer, I mean Medicare will be second payer.",cannot tell,neutral,neutral,unrelated,neutral
"1000% recommend it! We had it in 2020 for my grandfather. He was at a point where there was no reason to prolong his life. His brain tumor caused cognitive issues and he also had prostate cancer. Not only did it keep the pain manageable, but the nurses gave us step-by-step instructions for what to expect and what to do when he died. Personally, I want my husband to get me palliative care when my brain tumors destroy the quality of life I have left. I don't want him to feel solely responsible for my care. I need the comfort of knowing that I am not going to suffer in my final days. We are very young with a very young child and I am not naive enough to expect I will live long enough to reach my 40s. My family needs to be able to spend time taking care of my child and managing their responsibilities that pay the bills.",positive,positive,positive,support,support
"Long time Seattle resident here, you are fortunate to have access to great medical care and research. My diagnosis week was not as traumatic, it still feels like I’m in a vacuum from 3/9. 
 My first doctor‘s nurse called me at the end of the second week and said I’m going to be extremely frank with you. She said it’s time for you to be the patient, it’s time for you to take care of yourself to eat and sleep and rest and stay healthy because you are young and you can beat this. 
 I too was worried about telling people in the burden of it as my mom had passed of the same disease that I now have. My palliative doctor said this is your diagnosis, and your disease you proceed how you want to. It feels selfish - this is about you. You don’t have take on their sadness. 
 The port is weird to have mines 2 weeks old and I just did my second round with it. 
 Best of luck to you! xox",positive,positive,neutral,support,neutral
"yes yes, definitely stay away from the googles. It will only make you more upset. 
 
 First, I disagree a little with the others. But I think it depends on your existing relationship. Are you close? Like besties? Is she more authoritative and distant? I think moving forward, if you're not there, having a close relationship requires honesty. I say, be open and honest with her with your feelings. Chances are if you're feeling scared or nervous or anxious or even mad -- she's feeling it too and you can both talk about how cancer makes you feel. You may even feel a little less alone by the end, each realizing you're not alone. Become good friends, talk to her like you would your bestie. Sometimes she might just want to sit and talk, maybe even about something other than cancer. Ask her to tell you some funny stories about when you were little. Tell her some memories that you remember (she might not even realize you remembered those things). I didn't get super close with my mom until I came home from college, when I realized that she is just a human being and doing absolutely the best she can. It was too easy for me in high school to lose our relationship in my own selfishness. You may not have the luxury of taking your sweet time to come to the realization that no one in this world loves you as much as your mother does. The sooner you realize that, the easier it will be to transform your relationship from mother/daughter into the best of friends. I think honesty is the best policy, if you have questions about her treatments or medicines, ask her. Ask her if she wants someone to come sit with her while she does her chemo or waits in the waiting room for another doc appointment. Sometimes just being there means the world.
 
 What kind of cancer is it and what stage is she? I don't want to give you all kind of palliative advice when what you really need is hope. It is a HUGE difference. Without knowing, my best advice is to live each and every day like it might be your last day together. Skip hanging out with your friends or going to the movies and just hang out with your mom. If she's mobile, take her on a mother daughter date. Tell her you just want to spend time with her. Even if it's just sitting on the couch watching tv together. In 20 years you won't even remember your friends names and while hanging out at the mall may seem important now, you'll look back and be so happy you have those memories with your mom instead. Stay strong, you can do it.",negative,neutral,neutral,oppose,neutral
"Thanks so much for your reply! That's actually really good to know...I assumed hospice care (or at the very least, a nurse going to their house to clean up any messes and make him comfortable) was what palliative meant. It's nice to know there are options.
 And it sounds like you've found a solution that works for you...notice something, get it checked out; get checked regularly. Glad you're still around and kicking...keep taking care of yourself :)",cannot tell,positive,positive,unrelated,neutral
You can ask your cancer centre for a referral for a dietician and they can look at supplements etc.. it depends on where she’s at in her palliative care journey… unfortunately toward the end decrease/lack of appetite is a thing… but yeah it’s hard to ascertain with the information given… so I would ask her team about a dietician,neutral,neutral,neutral,neutral,neutral
"I would highly recommend palliative care. I take oral chemotherapy everyday. I used to be on 3, however my partner made me rso (Rick Simpson oil) and I take higher doses of this than a normal person would, but let's face it I'm not normal. I've been battling for 7 years now. Chemotherapy sucks in do many ways, but this medication stops my organs from shutting down.",positive,positive,positive,support,neutral
"I'm so sorry. I hope you feel less lonely after making this post! We are thinking about you!
 
 Have you discussed palliative care with your team? A lot of people associate palliative care with hospice (or ""giving up""), but it can offer other types of support, like mental health or focusing on quality of life. Ignore this if it's not helpful",positive,positive,positive,support,support
"Not selfish at all. You're, coolly trying to decide what's best for you and your family. It's a shit position to be in.
 
 Your partner wants you around. That's a plus for staying.
 
 Nobody knows your prognosis - that's a neutral.
 
 I'd stick around. Start treatment and see where it leads you. If you start suffering. If the pain starts to be too much and affects the quality of your life maybe then you could stop treatment and go for hospice or palliative care.
 
 In my case - I've stage IV lung cancer - I decided on my options 2 years back:
 
 As long as I'm not in serious pain
 
 
  AND
 I've still got my metal faculties
 
 
  AND
 I'm not too much of a burden to my family
 
 
  AND
 I don't get invited to the pity parties much
 
 
 
 Then I stay. The main things are not being in constant pain and not being a burden to my family. 
 
 With a lot of luck and some decent treatment breaks I could be around for another 10 to 15. As long as it's not in pain - that's worth fighting for.
 
 
 
 You're not being selfish, my friend, you're being pragmatic. As long as you can squeeze a few drops of joy out of life then you should stay. When it gets too much, bow out gracefully
 
 
 
 Good luck",positive,neutral,neutral,support,neutral
"Yeah, in this situation they should have sent y’all straight to the palliative doctor from day one, or at least made the introduction.
 
 You can always ask the doctor why they are doing something, I’m not sure why they are doing such frequent MRIs then in that situation. Worst case, you don’t actually have to get the MRI, but that might make receiving treatment difficult at the clinic. I’d try to ask why on the MRI, explain the problems that you are facing, and they should usually be able to work with you.",positive,neutral,neutral,support,neutral
"Please speak with your Oncologist about this ASAP.
 
 I suffered from pneumonitis, post chest radiation, and I couldn't walk 10 steps without losing my breath and I was in so much pain from the burning in my chest, etc. My Oncologist put me on temporary steroids, prednisone. I took them for 6 weeks and I felt like superwoman 🦸‍♀️ during that time. It was a miracle to get such relief. I was able to do so many things that I couldn't before. I felt like a whole new person during that time. 
 
 Once I was healed from the pneumonitis though, we tapered off the steroids. It was a life saver for me and greatly improved my quality of life. Please ask your Oncologist, not palliative care, about maybe trying daily prednisone temporarily. See what they say about it. It's worth a shot to ask anyway. We have to advocate for ourselves. 
 
 Wishing you the best, OP. Please update us on your condition after speaking with your Onc. Sending comforting hugs 🫂 in the meantime.",cannot tell,cannot tell,positive,unrelated,neutral
"Looking back at your OP, you need to know that stage 4 breast cancer is essentially incurable. From the time she was diagnosed with mets in the lungs, everything she's done is considered palliative - it's for comfort and to buy some extra time. There are only very, very rare instances that stage 4 breast cancer patients live a long life. Oftentimes, they receive chemo until their cancer develops resistance, then they get switched to another, and another... until there aren't any options left or the patient decides to stop treatment. 
 
 I'm very sorry for your mom's diagnosis. It's incredibly sad and difficult, and I wish there was more I could offer. My heart goes out to you",positive,positive,neutral,support,support
"Hi mate which country is it? Also how are you performing physically at this moment?
 
 Also where has the cancer spread to?
 
 Ask your doctor - Why hasn't immunotherapy (keytruda drug or others) been recommended?
 
 Metastatic cancer doesn't necessarily mean end of life. 
 Sometimes, people even end up with no evidence of disease.
 
 Also it appears that the doctors are moving you to palliative chemo which is low dose chemo.
 
 Here is what you need to do (Time is critical) -
 
 You need to get a 2nd opinion ASAP from doctors in your country - questions like what treatments are available, what combination of chemo drug do they recommend, can they still go for full dose chemo for you?
 
 Get a Free 2nd opinion from Hospital in India - [https://www.maxhealthcare.in/](https://www.maxhealthcare.in/)
 
 Get a Free opinion from this clinic in Germany - [https://www.medias-klinikum.de/](https://www.medias-klinikum.de/)
 
 [What treatments are available in US/Canada ?](https://tommera.com/health-and-beauty/how-to-know-what-treatments-are-available-for-cancer/) 
 
 Also you can see clinical trials availability on Clinical Trials gov website - [https://clinicaltrials.gov/](https://clinicaltrials.gov/)
 
 &amp;#x200B;
 
 \~\~\~\~\~\~ I don't know your financial situation but there might be some cancer vaccines available as well - [https://www.cancerresearchuk.org/about-cancer/cancer-in-general/treatment/immunotherapy/types/vaccines-to-treat-cancer](https://www.cancerresearchuk.org/about-cancer/cancer-in-general/treatment/immunotherapy/types/vaccines-to-treat-cancer)",neutral,neutral,neutral,neutral,oppose
"I totally get why you don't like the ""you're going to be ok"" comments. I often think like: ""yeah, cool... and what if not?"" 
 
 But the truth is that right now, you really don't know. So don't fixate (if that's a word?) on the possibility of it having spread too much. Because you might be ok.
 
 Also if not: even only getting palliative treatment might not be an immediate death sentence. I have been diagnosed with stage IV colon cancer in 2013. I still got curative treatment initially. It didn't work, so my treatment has been officially palliative and my cancer declared incurable since 2014. I'm still here. The last few weeks haven't been great and I fear that I won't be here much longer if there is no miracle. But still: those years I got so far... years that weren't a walk in the park... they're precious. 
 
 But your prognosis might be better than mine. Again: so far, you don't know. And it sucks to have to wait for something like this. I get it. 
 
 Try to do some normal activities. Distraction helps. Hug your kid, watch your favorite sitcom, go out for drinks or dinner with a friend, do a BBQ, go swimming, play board games, whatever you like etc. I found things like this important. Make yourself feel normal... cancer is not what defines you.
 
 I wish you all the best!",neutral,positive,positive,neutral,neutral
